{
  "$schema": "https://json-schema.org/draft/2020-12/schema",
  "title": "research_returns.json — the research-return dock",
  "type": "object",
  "required": ["schemaVersion", "questions", "returns"],
  "additionalProperties": false,
  "properties": {
    "schemaVersion": { "type": "integer", "const": 1 },
    "_note": { "type": "string" },
    "graceDays": {
      "type": "integer",
      "minimum": 1,
      "description": "How long a return may sit in triage with unrouted findings before bin/research-dock.py --strict fails."
    },
    "questions": {
      "type": "array",
      "items": { "$ref": "#/$defs/question" }
    },
    "returns": {
      "type": "array",
      "items": { "$ref": "#/$defs/return" }
    }
  },
  "$defs": {
    "question": {
      "type": "object",
      "required": ["id", "title", "primaryTool", "status"],
      "additionalProperties": false,
      "properties": {
        "id": { "type": "string", "pattern": "^RQ-[0-9]+$" },
        "title": { "type": "string", "minLength": 10 },
        "primaryTool": { "enum": ["openevidence", "chatgpt-deep-research", "claude", "other"] },
        "promptRef": { "type": "string" },
        "status": { "enum": ["open", "asked", "answered", "retired"] },
        "note": { "type": "string" }
      }
    },
    "return": {
      "type": "object",
      "required": ["id", "question", "tool", "returnedOn", "returnFile", "sourceKind", "status", "findings"],
      "additionalProperties": false,
      "properties": {
        "id": { "type": "string", "pattern": "^rq-[0-9]+-[0-9]{4}-[0-9]{2}-[0-9]{2}(-[a-z0-9]+)?$" },
        "question": { "type": "string", "pattern": "^RQ-[0-9]+$" },
        "tool": { "enum": ["openevidence", "chatgpt-deep-research", "claude", "other"] },
        "askedOn": { "type": "string", "pattern": "^\\d{4}-\\d{2}-\\d{2}$" },
        "returnedOn": { "type": "string", "pattern": "^\\d{4}-\\d{2}-\\d{2}$" },
        "returnFile": {
          "type": "string",
          "description": "Repo-relative path to the saved verbatim return. Lives under Evidence Inbox/_research-returns/ so the OpenEvidence scanner (os.listdir, non-recursive) does not treat it as a candidate source."
        },
        "sourceKind": {
          "const": "secondary",
          "description": "A model synthesis is ALWAYS secondary. It licenses nothing on its own. This is a constant, not a choice — the checker enforces it."
        },
        "status": { "enum": ["triage", "closed"] },
        "closedOn": { "type": "string", "pattern": "^\\d{4}-\\d{2}-\\d{2}$" },
        "note": { "type": "string" },
        "findings": {
          "type": "array",
          "items": { "$ref": "#/$defs/finding" }
        }
      }
    },
    "finding": {
      "type": "object",
      "required": ["id", "claim", "disposition"],
      "additionalProperties": false,
      "properties": {
        "id": { "type": "string", "pattern": "^f[0-9]+$" },
        "claim": {
          "type": "string",
          "minLength": 15,
          "description": "One sentence: what the return asserts. Written so a reader can judge it without opening the return."
        },
        "disposition": {
          "enum": ["needs-primary", "adopt", "cite", "supersedes", "reject", "no-action"],
          "description": "needs-primary is the only unrouted state and is what the grace-period check counts."
        },
        "primary": { "$ref": "#/$defs/primary" },
        "landedIn": {
          "type": "array",
          "items": { "type": "string", "minLength": 1 },
          "description": "Where the finding actually changed the library — an evidence_registry.json source id, a page path, a decisions.json id."
        },
        "followUp": { "$ref": "#/$defs/followUp" },
        "note": { "type": "string" }
      }
    },
    "followUp": {
      "type": "object",
      "required": ["kind", "mechanism", "requires", "verifiedOn", "evidence"],
      "additionalProperties": false,
      "description": "OPTIONAL, and absent by default: a finding with no followUp is carried by a person, which needs no proof. Present, it claims an AUTOMATION is carrying the finding — and that claim is checked like any other. The dock refuses to let a model's word stand as a primary source; this refuses to let an automation's existence stand as proof of its capability. bin/research-dock.py verifies that every capability named in `requires` literally appears in the `evidence` capture, because an automation created without the connector it needs prints one line and then looks identical to a working one forever after.",
      "properties": {
        "kind": {
          "enum": ["scheduled-task", "workflow", "gate"],
          "description": "What sort of machinery this is. There is no `manual` kind: a person carrying a finding is the default and is expressed by omitting followUp entirely."
        },
        "mechanism": {
          "type": "string",
          "minLength": 3,
          "description": "The identifier of the thing that does the work — a trigger id, a workflow name, a verify.sh step. Must be specific enough that a reader can go look at it."
        },
        "requires": {
          "type": "array",
          "minItems": 1,
          "items": { "type": "string", "minLength": 2 },
          "description": "Every capability the mechanism needs in order to do what this finding claims it does — a connector name, a tool, a device binding. Naming nothing is how an automation gets believed, so at least one is mandatory."
        },
        "verifiedOn": {
          "type": "string",
          "pattern": "^\\d{4}-\\d{2}-\\d{2}$",
          "description": "The date the capture was actually taken. An unchecked automation is a rumour. Past graceDays this reports (advisory, never blocking) that it is due for a re-check."
        },
        "evidence": {
          "type": "string",
          "minLength": 3,
          "description": "Repo-relative path to a dated local capture of what the mechanism can reach — the connector list, the tool inventory, the binding result. Unlike returnFile these captures are TRACKED, so a missing one blocks."
        },
        "note": { "type": "string" }
      }
    },
    "primary": {
      "type": "object",
      "required": ["citation"],
      "additionalProperties": false,
      "description": "An artifact that exists independently of the model. Two kinds qualify, and the checker requires one or the other before a finding may be adopted/cited/superseded: a PUBLISHED source identified by pmid or doi, or a CUSTODIAN WEB SOURCE identified by url + retrievedAt + archivedCopy. The web variant exists because most of this project's standing questions point at organizational documents — ACGME, ABPN, AAMC, CSWE, INACSL, CMS, instrument custodians — that carry no DOI at all. A DOI is stable; a web sentence is not, so the web variant demands a dated local capture in exchange.",
      "properties": {
        "citation": { "type": "string", "minLength": 10 },
        "pmid": { "type": "string", "pattern": "^[0-9]{1,9}$" },
        "doi": { "type": "string", "minLength": 5 },
        "url": {
          "type": "string",
          "pattern": "^https://",
          "description": "Absolute https URL of the custodian-hosted artifact. Required for the web variant."
        },
        "retrievedAt": {
          "type": "string",
          "pattern": "^\\d{4}-\\d{2}-\\d{2}$",
          "description": "The date the url was actually read. Required for the web variant — an undated web claim is a rumour."
        },
        "archivedCopy": {
          "type": "string",
          "minLength": 3,
          "description": "Repo-relative path to a dated local capture (PDF or screenshot) of what the url said on retrievedAt. Required for the web variant. This is what makes a web source as checkable as a DOI: the page can change silently, the capture cannot."
        }
      }
    }
  }
}
