{
  "schemaVersion": 1,
  "_note": "The research-return dock. A deep-research answer is a SECONDARY source: it licenses nothing on its own. This registry records the question that was asked, the answer that came back, and the routing decision for every finding inside it, so an answer either becomes governed content (via evidence_registry.json + evidence_annotations.json, per EVIDENCE_INBOX_RUNBOOK.md step 5) or a recorded decision not to use it. Nothing is allowed to stay undecided. Run: python3 bin/research-dock.py status | check | new. Runbook: docs/RESEARCH_RETURN_DOCK.md.",
  "graceDays": 21,
  "questions": [
    {
      "id": "RQ-1",
      "title": "What standards spine should govern the resident site?",
      "primaryTool": "chatgpt-deep-research",
      "promptRef": "docs/_planning/DEEP_RESEARCH_PROMPTS_2026-09-10.md#rq-1",
      "status": "asked",
      "note": "Asked twice on 2026-09-10. rq-1-2026-09-10 (chatgpt-deep-research) returned a crosswalk MECHANISM with a PLACEHOLDER framework and answered nothing. rq-1-2026-09-10-2 (claude) ANSWERS it: seven frameworks inventoried, Milestones 2.0 recommended as the resident spine on a VERIFIED express educational grant, a real crosswalk showing 43% unmappable, and a rotation-level 11/21 subset. Not marked answered yet: the student half is unresolved (LCME is missing from the question) and the spine choice is Josh's decision. Running one question on two tools is what separated the container from the answer. || 2026-09-10: student-site audience settled as clerkship-director/content-coverage, which selects ADMSEP over Core EPAs. Resident spine (Milestones 2.0) still awaiting Josh's formal adoption decision; the grant evidence is verified and captured."
    },
    {
      "id": "RQ-2",
      "title": "What is the minimum defensible QI and patient-safety curriculum for inpatient psychiatry?",
      "primaryTool": "chatgpt-deep-research",
      "promptRef": "docs/_planning/DEEP_RESEARCH_PROMPTS_2026-09-10.md#rq-2",
      "status": "open"
    },
    {
      "id": "RQ-3",
      "title": "Is our suicide-risk teaching aligned with 2024-2026 consensus?",
      "primaryTool": "openevidence",
      "promptRef": "docs/_planning/DEEP_RESEARCH_PROMPTS_2026-09-10.md#rq-3",
      "status": "open"
    },
    {
      "id": "RQ-4",
      "title": "AI standardized patients: evidence, harm profile, and disclosure posture",
      "primaryTool": "chatgpt-deep-research",
      "promptRef": "docs/_planning/DEEP_RESEARCH_PROMPTS_2026-09-10.md#rq-4",
      "status": "open"
    },
    {
      "id": "RQ-5",
      "title": "What evaluation design survives aggregate-only analytics?",
      "primaryTool": "claude",
      "promptRef": "docs/_planning/DEEP_RESEARCH_PROMPTS_2026-09-10.md#rq-5",
      "status": "open"
    },
    {
      "id": "RQ-6",
      "title": "Landscape scan: where is the defensible contribution?",
      "primaryTool": "chatgpt-deep-research",
      "promptRef": "docs/_planning/DEEP_RESEARCH_PROMPTS_2026-09-10.md#rq-6",
      "status": "open"
    },
    {
      "id": "RQ-7",
      "title": "What is a defensible attestation decay and re-attestation policy?",
      "primaryTool": "claude",
      "promptRef": "docs/_planning/DEEP_RESEARCH_PROMPTS_2026-09-10.md#rq-7",
      "status": "open"
    },
    {
      "id": "RQ-8",
      "title": "What can we claim about 192 locally authored question-bank items?",
      "primaryTool": "claude",
      "promptRef": "docs/_planning/DEEP_RESEARCH_PROMPTS_2026-09-10.md#rq-8",
      "status": "open"
    },
    {
      "id": "RQ-9",
      "title": "Which learner tracks are defensible, and at what cost?",
      "primaryTool": "chatgpt-deep-research",
      "promptRef": "docs/_planning/DEEP_RESEARCH_PROMPTS_2026-09-10.md#rq-9",
      "status": "open"
    },
    {
      "id": "RQ-10",
      "title": "Instrument rights: can the COWS interim waiver be closed?",
      "primaryTool": "chatgpt-deep-research",
      "promptRef": "docs/_planning/DEEP_RESEARCH_PROMPTS_2026-09-10.md#rq-10",
      "status": "asked"
    }
  ],
  "returns": [
    {
      "id": "rq-10-2026-09-10",
      "question": "RQ-10",
      "tool": "chatgpt-deep-research",
      "askedOn": "2026-09-10",
      "returnedOn": "2026-09-10",
      "returnFile": "Evidence Inbox/_research-returns/rq-10-2026-09-10.md",
      "sourceKind": "secondary",
      "status": "triage",
      "findings": [
        {
          "id": "f1",
          "claim": "The only COWS permission language located — \"This version may be copied and used clinically\" (Wesson & Ling 2003) — licenses clinical copying and does not on its face authorise public educational web display, so the 45 verbatim anchors are not covered.",
          "disposition": "needs-primary",
          "primary": {
            "citation": "Wesson DR, Ling W. The Clinical Opiate Withdrawal Scale (COWS). J Psychoactive Drugs. 2003;35(2):253-259.",
            "doi": "10.1080/02791072.2003.10400007"
          },
          "note": "This is the direct answer to RQ-10 and it closes the interim waiver AGAINST keeping the anchors. Verify by retrieving the 2003 article itself and reading the template legend verbatim — the return quotes it via the PubMed abstract, which is secondary. If it holds, cows moves flagged-interim -> retired/restricted in instrument_rights.json with a new decisionRef, and the 45 anchors in withdrawal.html come out on the CIWA-Ar pattern. Blocked on f3: a withdrawal must leave a route. || CORROBORATED 2026-09-10: the NIDA-hosted form (https://nida.nih.gov/sites/default/files/ClinicalOpiateWithdrawalScale.pdf, retrieved 2026-09-10) carries the identical clinical-scoped permission line on an artifact independent of both the model and the paywalled article. That is a second witness to the LANGUAGE, not to the SCOPE analysis, so this stays needs-primary until the 2003 template legend is read directly. Note this finding's best evidence is a PDF with no DOI — the case that motivated the primary.url + retrievedAt + archivedCopy variant added in this change."
        },
        {
          "id": "f2",
          "claim": "No scale-specific chain of title for the COWS instrument text could be established publicly; Taylor & Francis administers permissions for the journal article but is not shown to control the instrument wording.",
          "disposition": "needs-primary",
          "primary": {
            "citation": "Taylor & Francis permissions guidance for psychometric scales and questionnaires (publisher policy page).",
            "url": "https://taylorandfrancis.com/corporate-solutions/licensing/journals/"
          },
          "note": "Practical consequence: a RightsLink purchase would not by itself clear the instrument. Any request must ask T&F to confirm it controls the COWS wording or name who does. Return estimates 6-8 weeks for a manual request, no published fee for nonprofit public-web educational reuse."
        },
        {
          "id": "f3",
          "claim": "No current custodian-hosted canonical COWS form was found; the 2003 article's list of PDF hosts (ASAM, CSAM, UCLA ISAP, AlcoholMD) is historical, leaving the paywalled article DOI as the only defensible canonical link.",
          "disposition": "reject",
          "note": "FALSIFIED 2026-09-10 by direct retrieval, not by search. NIDA hosts a complete, current COWS form at https://nida.nih.gov/sites/default/files/ClinicalOpiateWithdrawalScale.pdf — all 11 items and severity anchors, source-attributed to Wesson & Ling 2003, carrying the same 'This version may be copied and used clinically' line. ASAM hosts a second copy (cows_induction_flow_sheet.pdf) but strips the copyright and permission line, so NIDA is the better citation. The claimed operational blocker does not exist: a retirement CAN leave a route and satisfy INV-IR2. The error is worse than a search miss — line 107 of the return names NIDA, ASAM and SAMHSA among the hosts it searched and dismisses them because the 2003 ARTICLE's host list is historical. It inherited staleness from a cited document and projected it onto the live web. Proposed failureMode vocabulary entry: source-date-contamination. One question remains and it is governance, not research: NIDA is a federal agency hosting a copy, not the rightsholder, so whether it satisfies the 'custodian URL, not a copy hosted here' wording of INV-IR2 is Josh's call."
        },
        {
          "id": "f4",
          "claim": "The current PHQ Screeners site (Pfizer) states that no permission is required to reproduce, translate, display or distribute the PHQ and GAD-7 screeners, which is the express public-web permission WP-02c was left open to verify.",
          "disposition": "needs-primary",
          "primary": {
            "citation": "PHQ Screeners (Pfizer Inc.), permission statement on the select-screener page.",
            "url": "https://www.phqscreeners.com/select-screener",
            "retrievedAt": "2026-09-10",
            "archivedCopy": "docs/permissions/phqscreeners-2026-09-10.md"
          },
          "note": "Would move phq9-gad7 from provisional -> cleared. Verify by fetching the live page, not by trusting this quote, and archive a dated PDF/screenshot into the permissions file — the whole permission is a web sentence that can change without notice. Corroborated independently by the LOINC record for PHQ-9 and GAD-7. || VERIFIED 2026-09-10 by live retrieval in Chrome, not from the return: the sentence is present verbatim on the custodian's own page and is captured with its context in docs/permissions/phqscreeners-2026-09-10.md. The evidence half of this finding is finished and satisfies the url+retrievedAt+archivedCopy variant. It stays needs-primary because promoting it MEANS moving phq9-gad7 provisional -> cleared, and instrument_rights.json's own rule is that a status changes only with the decisionRef that recorded it, never by agent inference. One decisions.json entry away."
        },
        {
          "id": "f5",